{
  "version": 1,
  "appReferences": {},
  "exactMetadata": false,
  "title": "PAPA PIZZA V5.5 — Referencia direta do arquivo",
  "shortcutName": "PAPA PIZZA V5.5",
  "shortcutMetadata": {
    "data": "YnBsaXN0MDDbAQIDBAUGBwgJCgsMDQ4ODxQVKSorLF8QFVdGUXVpY2tBY3Rpb25TdXJmYWNlc18QF1dGV29ya2Zsb3dDbGllbnRWZXJzaW9uXxAbV0ZXb3JrZmxvd0hhc091dHB1dEZhbGxiYWNrXxAjV0ZXb3JrZmxvd0hhc1Nob3J0Y3V0SW5wdXRWYXJpYWJsZXNeV0ZXb3JrZmxvd0ljb25fEBlXRldvcmtmbG93SW1wb3J0UXVlc3Rpb25zXxAhV0ZXb3JrZmxvd0lucHV0Q29udGVudEl0ZW1DbGFzc2VzXxAeV0ZXb3JrZmxvd01pbmltdW1DbGllbnRWZXJzaW9uXxAkV0ZXb3JrZmxvd01pbmltdW1DbGllbnRWZXJzaW9uU3RyaW5nXxAiV0ZXb3JrZmxvd091dHB1dENvbnRlbnRJdGVtQ2xhc3Nlc18QD1dGV29ya2Zsb3dUeXBlc6BWNDcxMS40CNIQERITXxAZV0ZXb3JrZmxvd0ljb25HbHlwaE51bWJlcl8QGFdGV29ya2Zsb3dJY29uU3RhcnRDb2xvchHwABP/////qamp/6CvEBMWFxgZGhscHR4fICEiIyQlJicoXxAQV0ZBcHBDb250ZW50SXRlbV8QGFdGQXBwU3RvcmVBcHBDb250ZW50SXRlbV8QFFdGQXJ0aWNsZUNvbnRlbnRJdGVtXxAUV0ZDb250YWN0Q29udGVudEl0ZW1fEBFXRkRhdGVDb250ZW50SXRlbV8QGVdGRW1haWxBZGRyZXNzQ29udGVudEl0ZW1fEBNXRkZvbGRlckNvbnRlbnRJdGVtXxAYV0ZHZW5lcmljRmlsZUNvbnRlbnRJdGVtXxASV0ZJbWFnZUNvbnRlbnRJdGVtXxAaV0ZpVHVuZXNQcm9kdWN0Q29udGVudEl0ZW1fEBVXRkxvY2F0aW9uQ29udGVudEl0ZW1fEBdXRkRDTWFwc0xpbmtDb250ZW50SXRlbV8QFFdGQVZBc3NldENvbnRlbnRJdGVtXxAQV0ZQREZDb250ZW50SXRlbV8QGFdGUGhvbmVOdW1iZXJDb250ZW50SXRlbV8QFVdGUmljaFRleHRDb250ZW50SXRlbV8QGldGU2FmYXJpV2ViUGFnZUNvbnRlbnRJdGVtXxATV0ZTdHJpbmdDb250ZW50SXRlbV8QEFdGVVJMQ29udGVudEl0ZW0RA4RTOTAwoKMtLi9VV2F0Y2hfEA9BY3Rpb25FeHRlbnNpb25fEBpXRldvcmtmbG93VHlwZVNob3dJblNlYXJjaAAIAB8ANwBRAG8AlQCkAMAA5AEFASwBUQFjAWQBawFsAXEBjQGoAasBtAG1AcsB3gH5AhACJwI7AlcCbQKIAp0CugLSAuwDAwMWAzEDSQNmA3wDjwOSA5YDlwObA6EDswAAAAAAAAIBAAAAAAAAADAAAAAAAAAAAAAAAAAAAAPQ",
    "encoding": "binary-plist"
  },
  "entry": "Main.shortcuty",
  "active": "Main.shortcuty",
  "files": [
    {
      "name": "Main.shortcuty",
      "contents": "# PAPA PIZZA V5.5 — acoes nativas diretas; execucao corrigida pendente no iPhone.\n# Cadastro original somente leitura. Nenhuma funcao auxiliar ou condicao composta.\nshortcut:\n  modo = \"SAIR\"\n  menu(\"PAPA PIZZA | Conferencia\"):\n    case \"NOVA CONFERÊNCIA\":\n      modo = \"NOVA\"\n    case \"CONTINUAR CONFERÊNCIA\":\n      modo = \"CONTINUAR\"\n    case \"GERAR RESUMO\":\n      modo = \"RESUMO\"\n    case \"SAIR\":\n      modo = \"SAIR\"\n  if modo == \"SAIR\":\n    flow.stop()\n\n  alert(\"Selecione a pasta V5 em iCloud Drive/Atalhos/PAPA PIZZA/V5. Ela deve conter Conferencias, Backups e Resumos. Use sempre esta mesma pasta.\", title: \"Pastas prontas\")\n  bases = files.choose(picking_mode: \"Folders\", select_multiple: false)\n  base = item(bases, at: 1)\n  if base has no value:\n    flow.stop()\n  pastasConferencias = files.open(folder: base, path: \"Conferencias\", folder_contents: false, error_if_missing: true, show_picker: false)\n  pasta = item(pastasConferencias, at: 1)\n  pastasBackups = files.open(folder: base, path: \"Backups\", folder_contents: false, error_if_missing: true, show_picker: false)\n  backups = item(pastasBackups, at: 1)\n  pastasResumos = files.open(folder: base, path: \"Resumos\", folder_contents: false, error_if_missing: true, show_picker: false)\n  resumos = item(pastasResumos, at: 1)\n  ordem = list([\"18\", \"53\", \"59\", \"31\", \"12\", \"6\", \"37\", \"38\", \"36\", \"56\", \"55\", \"49\", \"33\", \"32\", \"3\", \"7\", \"24\", \"13\", \"19\", \"25\", \"57\", \"41\", \"44\", \"40\", \"43\", \"47\", \"8\", \"46\", \"26\", \"54\", \"50\", \"5\", \"21\", \"42\", \"45\", \"35\", \"9\", \"34\", \"29\", \"1\", \"2\", \"27\", \"20\", \"48\", \"30\", \"28\", \"17\", \"60\", \"23\", \"11\", \"15\", \"4\", \"22\", \"52\", \"10\", \"14\", \"16\", \"39\", \"51\", \"58\"])\n  nomesOrdenados = list([\"Abacaxi Picado\", \"Açúcar\", \"Álcool\", \"Alho Frito\", \"Alho Poró Fatiado\", \"Bacon Frito\", \"Bobina Grande\", \"Bobina Impressora\", \"Bobina Pequena\", \"Bombril\", \"Bucha\", \"Cachaça\", \"Caixa 30\", \"Caixa 35\", \"Calabresa Fatiada\", \"Carne Seca\", \"Catupiry\", \"Cebola Fatiada\", \"Champignon\", \"Cheddar\", \"Cloro\", \"Coca Normal 1,5\", \"Coca Normal 600\", \"Coca Zero 1,5\", \"Coca Zero 600\", \"Coloral\", \"Costela\", \"Creme de Alho\", \"Creme De Leite\", \"Detergente\", \"Fermento\", \"Frango Temperado\", \"Gorgonzola\", \"Guaraná 1,5\", \"Guaraná 600\", \"Ketchup\", \"Lombo Fatiado\", \"Maionese\", \"Manjericão\", \"Massa\", \"Molho\", \"Molho Barbecue\", \"Muçarela Ralada\", \"Óleo\", \"Orégano\", \"Ovo Cozido\", \"Palmito\", \"Papel Toalha\", \"Parmesão\", \"Pepperoni\", \"Pimentão Picado\", \"Presunto Fatiado\", \"Provolone\", \"Sal\", \"Salaminho\", \"Tomate Picado\", \"Tomate Seco\", \"Touca\", \"Trigo\", \"Veja\"])\n  referencia = data({\"1\": \"Massa\", \"2\": \"Molho\", \"3\": \"Calabresa Fatiada\", \"4\": \"Presunto Fatiado\", \"5\": \"Frango Temperado\", \"6\": \"Bacon Frito\", \"7\": \"Carne Seca\", \"8\": \"Costela\", \"9\": \"Lombo Fatiado\", \"10\": \"Salaminho\", \"11\": \"Pepperoni\", \"12\": \"Alho Poró Fatiado\", \"13\": \"Cebola Fatiada\", \"14\": \"Tomate Picado\", \"15\": \"Pimentão Picado\", \"16\": \"Tomate Seco\", \"17\": \"Palmito\", \"18\": \"Abacaxi Picado\", \"19\": \"Champignon\", \"20\": \"Muçarela Ralada\", \"21\": \"Gorgonzola\", \"22\": \"Provolone\", \"23\": \"Parmesão\", \"24\": \"Catupiry\", \"25\": \"Cheddar\", \"26\": \"Creme De Leite\", \"27\": \"Molho Barbecue\", \"28\": \"Ovo Cozido\", \"29\": \"Manjericão\", \"30\": \"Orégano\", \"31\": \"Alho Frito\", \"32\": \"Caixa 35\", \"33\": \"Caixa 30\", \"34\": \"Maionese\", \"35\": \"Ketchup\", \"36\": \"Bobina Pequena\", \"37\": \"Bobina Grande\", \"38\": \"Bobina Impressora\", \"39\": \"Touca\", \"40\": \"Coca Zero 1,5\", \"41\": \"Coca Normal 1,5\", \"42\": \"Guaraná 1,5\", \"43\": \"Coca Zero 600\", \"44\": \"Coca Normal 600\", \"45\": \"Guaraná 600\", \"46\": \"Creme de Alho\", \"47\": \"Coloral\", \"48\": \"Óleo\", \"49\": \"Cachaça\", \"50\": \"Fermento\", \"51\": \"Trigo\", \"52\": \"Sal\", \"53\": \"Açúcar\", \"54\": \"Detergente\", \"55\": \"Bucha\", \"56\": \"Bombril\", \"57\": \"Cloro\", \"58\": \"Veja\", \"59\": \"Álcool\", \"60\": \"Papel Toalha\"})\n  cadastro = data({})\n  registros = data({})\n  identificador = \"\"\n  inicio = \"\"\n  estado = \"ABERTA\"\n  origem = \"\"\n  nomeSessao = \"\"\n  ultimoJson = \"\"\n  ultimoHash = \"\"\n  arquivoPrincipal = null\n  recuperar = \"NAO\"\n  precisaSalvar = \"NAO\"\n  operacao = \"MENU\"\n  totalConferidos = 0\n\n  if modo == \"NOVA\":\n    alert(\"Selecione o cadastro original Papa_Pizza.json no iCloud Drive. Ele sera apenas lido.\", title: \"Cadastro\")\n    arquivosCadastro = files.choose(picking_mode: \"Files\", select_multiple: false)\n    arquivoCadastro = item(arquivosCadastro, at: 1)\n    partesCadastro = text.detect(input: arquivoCadastro)\n    textoCadastro = combine(partesCadastro, separator: \"\")\n    cadastroBruto = data.decode_json(input: textoCadastro)\n    cadastro = as_type(cadastroBruto, \"Dictionary\")\n    precisaSalvar = \"SIM\"\n    operacao = \"INICIAR\"\n  else:\n    pastaLeitura = pasta\n    if modo == \"CONTINUAR\":\n      menu(\"Origem da retomada\"):\n        case \"ARQUIVO PRINCIPAL\":\n          recuperar = \"NAO\"\n        case \"RECUPERAR BACKUP\":\n          recuperar = \"SIM\"\n          pastaLeitura = backups\n    arquivosHistorico = files.contents(folder: pastaLeitura)\n    ordenados = files.filter(items: arquivosHistorico, sort_by: \"Name\", order: \"Descending\")\n    recentes = list([])\n    anteriores = list([])\n    quantidadeHistorico = 0\n    for item in ordenados:\n      candidato = item\n      partesNome = files.name(item: candidato)\n      nome = combine(partesNome, separator: \"\")\n      extensaoCandidato = files.detail(file: candidato, property: \"File Extension\")\n      partesExtensaoCandidato = text.detect(input: extensaoCandidato)\n      extensaoHistorico = combine(partesExtensaoCandidato, separator: \"\")\n      if extensaoHistorico == \"json\":\n        nomeCompleto = \"NAO\"\n        if nome ends with \".json\":\n          nomeCompleto = \"SIM\"\n        if nomeCompleto == \"NAO\":\n          nome = text(\"\\(nome).json\")\n      if extensaoHistorico == \"json\":\n        if nome starts with \"Conferencia_\":\n          if nome ends with \".json\":\n            quantidadeHistorico = quantidadeHistorico + 1\n            if quantidadeHistorico <= 5:\n              variables.append(name: \"recentes\", value: nome)\n            else:\n              variables.append(name: \"anteriores\", value: nome)\n    if quantidadeHistorico == 0:\n      alert(\"Nao ha arquivos nesta pasta. O historico das versoes anteriores permanece na pasta antiga.\", title: \"Historico V5\")\n      flow.stop()\n    listaHistorico = recentes\n    if quantidadeHistorico > 5:\n      menu(\"Historico\"):\n        case \"CINCO MAIS RECENTES\":\n          listaHistorico = recentes\n        case \"ANTERIORES\":\n          listaHistorico = anteriores\n    selecionado = choose(listaHistorico)\n    partesSelecionado = text.detect(input: selecionado)\n    nomeSelecionado = combine(partesSelecionado, separator: \"\")\n    arquivosLidos = files.open(folder: pastaLeitura, path: nomeSelecionado, error_if_missing: true, show_picker: false)\n    arquivoLidoBruto = item(arquivosLidos, at: 1)\n    arquivoLido = as_type(arquivoLidoBruto, \"File\")\n    hashesLidos = data.hash(input: arquivoLido, algorithm: \"SHA256\")\n    ultimoHash = combine(hashesLidos, separator: \"\")\n    partesLidas = text.detect(input: arquivoLido)\n    ultimoJson = combine(partesLidas, separator: \"\")\n    bruto = data.decode_json(input: ultimoJson)\n    sessaoLida = as_type(bruto, \"Dictionary\")\n    campoBruto_1 = data.lookup(input: sessaoLida, dictionary_key: \"versao\")\n    versao = \"\"\n    if campoBruto_1 has value:\n      campoPartes_1 = text.detect(input: campoBruto_1)\n      versao = combine(campoPartes_1, separator: \"\")\n    campoBruto_2 = data.lookup(input: sessaoLida, dictionary_key: \"id\")\n    identificador